[
  {
    "id": "sm64",
    "title": "Super Mario 64",
    "platform": "Nintendo 64",
    "repo": "https://github.com/n64decomp/sm64",
    "tier": 1
  },
  {
    "id": "quake",
    "title": "Quake",
    "platform": "PC",
    "repo": "https://github.com/id-Software/Quake",
    "tier": 1
  },
  {
    "id": "oot",
    "title": "Ocarina of Time",
    "platform": "Nintendo 64",
    "repo": "https://github.com/zeldaret/oot",
    "tier": 2
  },
  {
    "id": "openra",
    "title": "OpenRA (Red Alert)",
    "platform": "PC",
    "repo": "https://github.com/OpenRA/OpenRA",
    "tier": 1
  }
]
